TITLE,LEADER,MEMBER,DISCRIPTION
基于可解释性和引导的大语言模型可控生成,程紫峰,张俊杰;孙长辉,通过构造引导向量、任务向量等方式来更好地引导大语言模型进行可控生成，如可信生成，去毒等。涉及激活引导、任务向量、可解释性、参数和激活定位、模型编辑等技术。
大模型句子嵌入抽取,程紫峰;符宇辰,吴文翔;王忠辉;孙长辉;钱凌云,通过模型干预，推断时引导，提示工程，可解释性等技术从大语言模型以及混合专家模型中抽取出更好的以及更符合要求的句子嵌入。
扩散大语言模型,程紫峰;干金玮,倪建乔;王皓,在扩散大语言模型的并行解码和双向注意力等机制下，实现可控生成、高效推断、reasoning等。
大语言模型安全,杨书璠;程紫峰,,设计有效的攻击和防御手段来更有效地偷窃和保护大语言模型、扩散大语言模型以及嵌入即服务的大语言模型，涉及水印清洗、水印盗用、模型水印等技术。
对话系统,罗翔,徐思恬,主要针对任务型对话系统的优化，包括用户模拟器构建、零样本对话状态追踪，旨在提升对话系统的跨领域适应能力和生成能力。
面向健壮性神经网络的动态数据选择方法,周翱,,传统训练方法对全量数据平等处理，导致模型易受冗余样本干扰，收敛效率低，且对噪声或分布偏移敏感，通过设计基于梯度稀疏性的样本重要性评分机制和动态阈值过滤策略，实现高效且健壮的数据选择，从而提升模型训练效率和泛化性能。